trial_id	trialacronym	phase	recruitmentstatus	recruitmentstate	approvaldate	actualstartdate	drug_list	drug_classes	combo_list	combo_classes	secondaryid	studytitle	healthcondition	postcode	ext_weblink
NCT04567615	2018-003151-38--CA224-073	Phase 2	Recruiting	NSW, NZ	28/09/2020	4/02/2021	Nivolumab; Nivolumab + Relatlimab; Relatlimab	anti-PD-1_monoclonal_antibody; anti-LAG3_monoclonal_antibody + anti-PD-1_monoclonal_antibody; anti-LAG3_monoclonal_antibody	Nivolumab; Nivolumab + Relatlimab; Nivolumab + Relatlimab	anti-LAG3_monoclonal_antibody + anti-PD-1_monoclonal_antibody; anti-PD-1_monoclonal_antibody; anti-LAG3_monoclonal_antibody + anti-PD-1_monoclonal_antibody	2018-003151-38  CA224-073	A Phase 2, Randomized, Open-label Study of Relatlimab in Combination With Nivolumab in Participants With Advanced Hepatocellular Carcinoma Who Are Naive to IO Therapy But Progressed on Tyrosine Kinase Inhibitors (RELATIVITY-073)	Liver Cancer, Adult; Hepatoma; Liver Cell Carcinoma, Adult; Liver Cell Carcinoma; Hepatocellular Carcinoma	Auckland; 2050 - Camperdown	https://clinicaltrials.gov/ct2/show/NCT04567615
NCT04612751	2021-000274-28--DS1062-A-U104	Phase 1	Recruiting	SA, NSW	3/11/2020	6/11/2020	Carboplatin; Cisplatin; Datopotamab deruxtecan; Datopotamab deruxtecan + Durvalumab; Durvalumab	anti-PD-L1_monoclonal_antibody; platinum-based_antineoplastic_agent; anti-Trop2_antibody-drug_conjugate; anti-PD-L1_monoclonal_antibody + anti-Trop2_antibody-drug_conjugate	Datopotamab deruxtecan + Durvalumab; Carboplatin; Cisplatin; Datopotamab deruxtecan + Durvalumab	anti-PD-L1_monoclonal_antibody + anti-Trop2_antibody-drug_conjugate; anti-PD-L1_monoclonal_antibody + anti-Trop2_antibody-drug_conjugate; platinum-based_antineoplastic_agent	2021-000274-28  DS1062-A-U104	A Phase 1b, Multicenter, 2-Part, Open-Label Study of Datopotamab Deruxtecan (Data-DXd) in Combination With Durvalumab With or Without Platinum Chemotherapy in Subjects With Advanced or Metastatic Non-Small Cell Lung Cancer (TROPION-Lung04)	Advanced or Metastatic NSCLC	2500 - Wollongong; 5042 - Bedford Park	https://clinicaltrials.gov/ct2/show/NCT04612751
NCT04619797	SKYSCRAPER-06	Unknown	Recruiting	NZ	6/11/2020	14/12/2020	Atezolizumab; Atezolizumab + Carboplatin + Cisplatin + Pemetrexed + Tiragolumab; Carboplatin; Carboplatin + Cisplatin + Pembrolizumab + Pemetrexed; Cisplatin; Pembrolizumab; Pemetrexed; Placebo; Tiragolumab	anti-TIGIT_monoclonal_antibody; placebo; anti-PD-L1_monoclonal_antibody + anti-TIGIT_monoclonal_antibody + antimetabolite + platinum-based_antineoplastic_agent; anti-PD-L1_monoclonal_antibody; anti-PD-1_monoclonal_antibody; platinum-based_antineoplastic_agent; antimetabolite; anti-PD-1_monoclonal_antibody + antimetabolite + platinum-based_antineoplastic_agent	Atezolizumab + Carboplatin + Cisplatin + Pemetrexed + Tiragolumab; Carboplatin + Cisplatin + Pembrolizumab + Pemetrexed; Atezolizumab + Carboplatin + Cisplatin + Pemetrexed + Tiragolumab; Carboplatin + Cisplatin + Pembrolizumab + Pemetrexed; Placebo	anti-PD-1_monoclonal_antibody + antimetabolite + platinum-based_antineoplastic_agent; anti-PD-L1_monoclonal_antibody + anti-TIGIT_monoclonal_antibody + antimetabolite + platinum-based_antineoplastic_agent; anti-PD-1_monoclonal_antibody + antimetabolite + platinum-based_antineoplastic_agent; anti-PD-L1_monoclonal_antibody + anti-TIGIT_monoclonal_antibody + antimetabolite + platinum-based_antineoplastic_agent; placebo	2020-002851-39  BO42592	A Phase II/III, Randomized, Double-Blind, Placebo-Controlled Study of Tiragolumab in Combination With Atezolizumab Plus Pemetrexed and Carboplatin/Cisplatin Versus Pembrolizumab Plus Pemetrexed and Carboplatin/Cisplatin in Patients With Previously Untreated Advanced Non-Squamous Non-Small-Cell Lung Cancer	Non-small Cell Lung Cancer (NSCLC)	Auckland; Palmerston North; Hamilton; Tauranga	https://clinicaltrials.gov/ct2/show/NCT04619797
NCT04626479	2019-003609-84--3475-03A	Phase 1/Phase 2	Recruiting	NZ, NSW, VIC, QLD	12/11/2020	16/12/2020	Belzutifan; Belzutifan + Lenvatinib + Pembrolizumab; Favezelimab; Favezelimab + Lenvatinib + Pembrolizumab; Lenvatinib; Lenvatinib + Pembrolizumab; Lenvatinib + Pembrolizumab + Quavonlimab; Pembrolizumab; Quavonlimab	VEGF_inhibitor + anti-LAG3_monoclonal_antibody + anti-PD-1_monoclonal_antibody; VEGF_inhibitor + anti-PD-1_monoclonal_antibody; VEGF_inhibitor + anti-CTLA-4_monoclonal_antibody + anti-PD-1_monoclonal_antibody; HIF2a_inhibitor + VEGF_inhibitor + anti-PD-1_monoclonal_antibody; HIF2a_inhibitor; anti-PD-1_monoclonal_antibody; VEGF_inhibitor; anti-LAG3_monoclonal_antibody; anti-CTLA-4_monoclonal_antibody	Belzutifan + Lenvatinib + Pembrolizumab; Favezelimab + Lenvatinib + Pembrolizumab; Lenvatinib + Pembrolizumab; Lenvatinib + Pembrolizumab + Quavonlimab; Belzutifan + Lenvatinib + Pembrolizumab; Favezelimab + Lenvatinib + Pembrolizumab; Lenvatinib + Pembrolizumab; Lenvatinib + Pembrolizumab + Quavonlimab	HIF2a_inhibitor + VEGF_inhibitor + anti-PD-1_monoclonal_antibody; VEGF_inhibitor + anti-CTLA-4_monoclonal_antibody + anti-PD-1_monoclonal_antibody; VEGF_inhibitor + anti-LAG3_monoclonal_antibody + anti-PD-1_monoclonal_antibody; VEGF_inhibitor + anti-PD-1_monoclonal_antibody; HIF2a_inhibitor + VEGF_inhibitor + anti-PD-1_monoclonal_antibody; VEGF_inhibitor + anti-CTLA-4_monoclonal_antibody + anti-PD-1_monoclonal_antibody; VEGF_inhibitor + anti-LAG3_monoclonal_antibody + anti-PD-1_monoclonal_antibody; VEGF_inhibitor + anti-PD-1_monoclonal_antibody	2019-003609-84  3475-03A	A Phase 1b/2 Study of Immune and Targeted Combination Therapies in Participants With RCC (U03): Substudy 03A	Carcinoma, Renal Cell	4029 - Herston; Auckland; 3084 - Heidelberg; 2148 - Blacktown; 2217 - Kogarah	https://clinicaltrials.gov/ct2/show/NCT04626479
NCT04626518	2019-003610-13--3475-03B	Phase 1/Phase 2	Recruiting	QLD, VIC, NSW, NZ	12/11/2020	17/12/2020	Belzutifan; Belzutifan + Lenvatinib; Belzutifan + Pembrolizumab; Favezelimab; Favezelimab + Pembrolizumab; Lenvatinib; Lenvatinib + Pembrolizumab; MK-4830; MK-4830 + Pembrolizumab; Pembrolizumab; Pembrolizumab + Quavonlimab; Quavonlimab	VEGF_inhibitor + anti-PD-1_monoclonal_antibody; anti-PD-1_monoclonal_antibody; anti-LAG3_monoclonal_antibody + anti-PD-1_monoclonal_antibody; anti-LAG3_monoclonal_antibody; anti-CTLA-4_monoclonal_antibody + anti-PD-1_monoclonal_antibody; HIF2a_inhibitor; anti-ILT4_monoclonal_antibody; VEGF_inhibitor; anti-ILT4_monoclonal_antibody + anti-PD-1_monoclonal_antibody; anti-CTLA-4_monoclonal_antibody; HIF2a_inhibitor + anti-PD-1_monoclonal_antibody; HIF2a_inhibitor + VEGF_inhibitor	Belzutifan + Lenvatinib; Belzutifan + Pembrolizumab; Favezelimab + Pembrolizumab; Lenvatinib + Pembrolizumab; MK-4830 + Pembrolizumab; Pembrolizumab + Quavonlimab; Belzutifan + Lenvatinib; Belzutifan + Pembrolizumab; Favezelimab + Pembrolizumab; Lenvatinib + Pembrolizumab; MK-4830 + Pembrolizumab; Pembrolizumab + Quavonlimab	HIF2a_inhibitor + VEGF_inhibitor; HIF2a_inhibitor + anti-PD-1_monoclonal_antibody; VEGF_inhibitor + anti-PD-1_monoclonal_antibody; anti-CTLA-4_monoclonal_antibody + anti-PD-1_monoclonal_antibody; anti-ILT4_monoclonal_antibody + anti-PD-1_monoclonal_antibody; anti-LAG3_monoclonal_antibody + anti-PD-1_monoclonal_antibody; HIF2a_inhibitor + VEGF_inhibitor; HIF2a_inhibitor + anti-PD-1_monoclonal_antibody; VEGF_inhibitor + anti-PD-1_monoclonal_antibody; anti-CTLA-4_monoclonal_antibody + anti-PD-1_monoclonal_antibody; anti-ILT4_monoclonal_antibody + anti-PD-1_monoclonal_antibody; anti-LAG3_monoclonal_antibody + anti-PD-1_monoclonal_antibody	2019-003610-13  3475-03B	A Phase 1b/2 Study of Immune and Targeted Combination Therapies in Participants With RCC (U03): Substudy 03B	Carcinoma, Renal Cell	Auckland; 2217 - Kogarah; 2148 - Blacktown; 3084 - Melbourne; 4029 - Herston	https://clinicaltrials.gov/ct2/show/NCT04626518
NCT04657991	STARBOARD--C4221016	Unknown	Recruiting	VIC, NZ	8/12/2020	15/01/2021	Binimetinib; Binimetinib + Encorafenib + Pembrolizumab; Encorafenib; Pembrolizumab; Placebo	anti-PD-1_monoclonal_antibody; MEK_inhibitor; BRAF_V600_inhibitor; placebo; BRAF_V600_inhibitor + MEK_inhibitor + anti-PD-1_monoclonal_antibody	Binimetinib + Encorafenib + Pembrolizumab; Pembrolizumab; Binimetinib + Encorafenib + Pembrolizumab; Placebo	BRAF_V600_inhibitor + MEK_inhibitor + anti-PD-1_monoclonal_antibody; anti-PD-1_monoclonal_antibody; BRAF_V600_inhibitor + MEK_inhibitor + anti-PD-1_monoclonal_antibody; placebo	STARBOARD  C4221016	A PHASE 3, RANDOMIZED, DOUBLE-BLIND STUDY OF ENCORAFENIB AND BINIMETINIB PLUS PEMBROLIZUMAB VERSUS PLACEBO PLUS PEMBROLIZUMAB IN PARTICIPANTS WITH BRAF V600E/K MUTATION-POSITIVE METASTATIC OR UNRESECTABLE LOCALLY ADVANCED MELANOMA	Melanoma	Auckland; Manawatu; Canterbury	https://clinicaltrials.gov/ct2/show/NCT04657991
NCT04730869	U1111-1262-0203--RD020132	Unknown	Recruiting	NZ	29/01/2021	26/05/2021	Temozolomide	alkylating_agent	Temozolomide	alkylating_agent	U1111-1262-0203  RD020132	Feasibility, Safety, and Efficacy of a Metabolic Therapy Program in Conjunction With Standard Treatment for Glioblastoma	Glioblastoma	Waikato	https://clinicaltrials.gov/ct2/show/NCT04730869
NCT04745689	TAZMAN	Phase 2	Recruiting	NSW	9/02/2021	23/02/2021	Barasertib; Barasertib + Durvalumab; Carboplatin; Cisplatin; Durvalumab; Etoposide	AURKB_inhibitor + anti-PD-L1_monoclonal_antibody; anti-PD-L1_monoclonal_antibody; platinum-based_antineoplastic_agent; topoisomerase_inhibitor; AURKB_inhibitor	Barasertib + Durvalumab; Barasertib + Durvalumab; Carboplatin; Cisplatin; Etoposide	AURKB_inhibitor + anti-PD-L1_monoclonal_antibody; AURKB_inhibitor + anti-PD-L1_monoclonal_antibody; platinum-based_antineoplastic_agent; topoisomerase_inhibitor	D6132C00001	A Phase II Multicenter, Open-Label, Single Arm Study to Determine the Efficacy, Safety and Tolerability of AZD2811 and Durvalumab Combination as Maintenance Therapy After Induction With Platinum-Based Chemotherapy Combined With Durvalumab, for the First-Line Treatment of Patients With Extensive Stage Small-Cell Lung Cancer	Small-Cell Lung Cancer	2500 - Wollongong; 2250 - North Gosford	https://clinicaltrials.gov/ct2/show/NCT04745689
NCT04746924	BGB-A317-A1217-302--AdvanTIG-302	Phase 3	Recruiting	SA, WA, QLD, VIC, NSW	10/02/2021	8/06/2021	Ociperlimab; Ociperlimab + Tislelizumab; Pembrolizumab; Placebo; Tislelizumab	anti-PD-1_monoclonal_antibody; anti-TIGIT_monoclonal_antibody; placebo; anti-PD-1_monoclonal_antibody + anti-TIGIT_monoclonal_antibody	Ociperlimab + Tislelizumab; Pembrolizumab; Tislelizumab; Ociperlimab + Tislelizumab; Placebo	anti-PD-1_monoclonal_antibody; anti-PD-1_monoclonal_antibody + anti-TIGIT_monoclonal_antibody; anti-PD-1_monoclonal_antibody + anti-TIGIT_monoclonal_antibody; placebo	BGB-A317-A1217-302  AdvanTIG-302	A Phase 3, Randomized, Double-Blind Study of BGB-A1217, an Anti-TIGIT Antibody, in Combination With Tislelizumab Compared to Pembrolizumab in Patients With Previously Untreated, PD-L1-Selected, and Locally Advanced, Unresectable, or Metastatic Non-Small Cell Lung Cancer	Non-small Cell Lung Cancer; NSCLC	4224 - Tugun; 3168 - Clayton; 3350 - Ballarat; 2065 - Saint Leonards; 2298 - Waratah; 3021 - St Albans; 4032 - Chermside; 6150 - Murdoch; 2139 - Concord; 5112 - Elizabeth Vale; 4101 - South Brisbane	https://clinicaltrials.gov/ct2/show/NCT04746924
NCT04760288	AcceleRET-MTC	Phase 3	Not yet recruiting	VIC, NSW, SA	18/02/2021		Cabozantinib; Cabozantinib + Vandetanib; Pralsetinib; Vandetanib	MET_inhibitor,type_2 + RET_inhibitor; AXL/MET/RET/VEGFR/ROS1/KIT_inhibitor + VEGFR2_inhibitor; EGFR_inhibitor,second_generation; AXL/MET/RET/VEGFR/ROS1/KIT_inhibitor; MET_inhibitor,type_2; EGFR_inhibitor,second_generation + RET_inhibitor; EGFR_inhibitor,second_generation + KIT_inhibitor; RET_inhibitor; EGFR_inhibitor,second_generation + MET_inhibitor,type_2; MET_inhibitor,type_2 + VEGFR2_inhibitor; AXL_inhibitor + RET_inhibitor; AXL_inhibitor; AXL/MET/RET/VEGFR/ROS1/KIT_inhibitor + RET_inhibitor; ROS1_inhibitor + VEGFR2_inhibitor; AXL/MET/RET/VEGFR/ROS1/KIT_inhibitor + EGFR_inhibitor,second_generation; KIT_inhibitor + RET_inhibitor; AXL_inhibitor + EGFR_inhibitor,second_generation; VEGFR2_inhibitor; AXL_inhibitor + VEGFR2_inhibitor; KIT_inhibitor + VEGFR2_inhibitor; ROS1_inhibitor; RET_inhibitor + ROS1_inhibitor; EGFR_inhibitor,second_generation + VEGFR2_inhibitor; EGFR_inhibitor,second_generation + ROS1_inhibitor; RET_inhibitor + VEGFR2_inhibitor; KIT_inhibitor	Cabozantinib + Vandetanib; Pralsetinib; Cabozantinib + Vandetanib	AXL/MET/RET/VEGFR/ROS1/KIT_inhibitor + EGFR_inhibitor,second_generation; AXL/MET/RET/VEGFR/ROS1/KIT_inhibitor + RET_inhibitor; AXL/MET/RET/VEGFR/ROS1/KIT_inhibitor + VEGFR2_inhibitor; AXL_inhibitor + EGFR_inhibitor,second_generation; AXL_inhibitor + RET_inhibitor; AXL_inhibitor + VEGFR2_inhibitor; EGFR_inhibitor,second_generation + KIT_inhibitor; EGFR_inhibitor,second_generation + MET_inhibitor,type_2; EGFR_inhibitor,second_generation + RET_inhibitor; EGFR_inhibitor,second_generation + ROS1_inhibitor; EGFR_inhibitor,second_generation + VEGFR2_inhibitor; KIT_inhibitor + RET_inhibitor; KIT_inhibitor + VEGFR2_inhibitor; MET_inhibitor,type_2 + RET_inhibitor; MET_inhibitor,type_2 + VEGFR2_inhibitor; RET_inhibitor; RET_inhibitor + ROS1_inhibitor; RET_inhibitor + VEGFR2_inhibitor; ROS1_inhibitor + VEGFR2_inhibitor; VEGFR2_inhibitor; AXL/MET/RET/VEGFR/ROS1/KIT_inhibitor + EGFR_inhibitor,second_generation; AXL/MET/RET/VEGFR/ROS1/KIT_inhibitor + RET_inhibitor; AXL/MET/RET/VEGFR/ROS1/KIT_inhibitor + VEGFR2_inhibitor; AXL_inhibitor + EGFR_inhibitor,second_generation; AXL_inhibitor + RET_inhibitor; AXL_inhibitor + VEGFR2_inhibitor; EGFR_inhibitor,second_generation + KIT_inhibitor; EGFR_inhibitor,second_generation + MET_inhibitor,type_2; EGFR_inhibitor,second_generation + RET_inhibitor; EGFR_inhibitor,second_generation + ROS1_inhibitor; EGFR_inhibitor,second_generation + VEGFR2_inhibitor; KIT_inhibitor + RET_inhibitor; KIT_inhibitor + VEGFR2_inhibitor; MET_inhibitor,type_2 + RET_inhibitor; MET_inhibitor,type_2 + VEGFR2_inhibitor; RET_inhibitor + ROS1_inhibitor; RET_inhibitor + VEGFR2_inhibitor; ROS1_inhibitor + VEGFR2_inhibitor	2020-005269-15  CO42865	A Phase III, Randomized, Open-Label Study of Pralsetinib Versus Standard of Care for Treatment of RET-Mutated Medullary Thyroid Cancer.	Thyroid Cancer	2109 - Macquarie Park; 5037 - Kurralta Park; 2065 - St. Leonards; 3004 - Melbourne	https://clinicaltrials.gov/ct2/show/NCT04760288
NCT04784715	D967UC00001	Phase 3	NOT_RECRUITING	QLD, NSW	5/03/2021	26/04/2021	Pertuzumab; Pertuzumab + Trastuzumab Deruxtecan; Placebo; Trastuzumab; Trastuzumab Deruxtecan	anti-ERBB2_monoclonal_antibody,dimerization_inhibitor; anti-ERBB2_antibody-drug_conjugate; anti-ERBB2_monoclonal_antibody; anti-ERBB2_antibody-drug_conjugate + anti-ERBB2_monoclonal_antibody,dimerization_inhibitor; placebo	Pertuzumab + Trastuzumab Deruxtecan; Pertuzumab + Trastuzumab Deruxtecan; Placebo	anti-ERBB2_antibody-drug_conjugate + anti-ERBB2_monoclonal_antibody,dimerization_inhibitor; anti-ERBB2_antibody-drug_conjugate + anti-ERBB2_monoclonal_antibody,dimerization_inhibitor; placebo	D967UC00001	Phase III Study of Trastuzumab Deruxtecan (T-DXd) With or Without Pertuzumab Versus Taxane, Trastuzumab and Pertuzumab in HER2-positive, First-line Metastatic Breast Cancer (DESTINY-Breast09)	Metastatic; Breast Cancer; HER2-positive	4066 - Auchenflower; 2065 - St Leonards; 2109 - Macquarie University	https://clinicaltrials.gov/ct2/show/NCT04784715
NCT04811027	TACTI-003	Phase 2	Recruiting	NSW	23/03/2021	27/08/2021	Eftilagimod Alpha; Pembrolizumab	anti-PD-1_monoclonal_antibody; T-cell_immunostimulatory_factor	Eftilagimod Alpha; Pembrolizumab	T-cell_immunostimulatory_factor; anti-PD-1_monoclonal_antibody	Keynote- PNC-34  TACTI-003	TACTI-003 (Two ACTive Immunotherapeutics): A Multicenter, Open Label, Randomized, Phase II Trial to Investigate a Soluble LAG-3 Fusion Protein, Eftilagimod Alpha (Efti; IMP321) in Combination With Pembrolizumab (PD-1 Antagonist) for First Line Treatment of Subjects With Unresectable Recurrent or Metastatic Squamous Cell Carcinoma of the Head and Neck (HNSCC)	HNSCC	2109 - Macquarie Park; 2640 - East Albury	https://clinicaltrials.gov/ct2/show/NCT04811027
NCT04814108	ZN-c3-004	Phase 2	Recruiting	VIC, NSW	24/03/2021	1/06/2021	ZN-C3	WEE1_inhibitor	ZN-C3	WEE1_inhibitor	ZN-c3-004	A Phase 2 Open-Label, Multicenter Study to Evaluate Efficacy and Safety of ZN-c3 in Adult Women With Recurrent or Persistent Uterine Serous Carcinoma	Uterine Serous Carcinoma	3144 - Malvern; 2065 - St Leonards; 3000 - Melbourne	https://clinicaltrials.gov/ct2/show/NCT04814108
NCT04875975	2019-004778-25--AIE001	Phase 2	Recruiting	SA	6/05/2021	27/09/2021	Placebo	placebo	Placebo	placebo	2019-004778-25  AIE001	A Randomized, Double-Blind, Placebo-Controlled, Multicenter, Phase 2 Study to Evaluate the Efficacy, Safety, and Pharmacokinetics of Rozanolixizumab in Adult Study Participants With Leucine-Rich Glioma Inactivated 1 Autoimmune Encephalitis	Leucine-Rich Glioma Inactivated 1 Autoimmune Encephalitis	- Melbourne	https://clinicaltrials.gov/ct2/show/NCT04875975
NCT04876651	PROSTACT	Phase 3	Not yet recruiting	WA	6/05/2021		177Lu-DOTA-rosopatamab	radioligand,PSMA-targeting	177Lu-DOTA-rosopatamab	radioligand,PSMA-targeting	177Lu-TLX591-002	A Multinational, Multicenter, Prospective, Randomized, Controlled, Open Label Phase 3 Study With Best Standard of Care With and Without 177Lu-DOTA-rosopatamab for Patients With PSMA Expressing Metastatic Castration-resistant Prostate Cancer Progressing Despite Prior Treatment With a Novel Androgen Axis Drug	Metastatic Prostate Cancer	6009 - Perth; 6150 - Perth	https://clinicaltrials.gov/ct2/show/NCT04876651
NCT04985825	I-PACE	Phase 2	Recruiting	WA, NSW, VIC	2/08/2021	16/12/2021	Imgatuzumab	anti-EGFR_monoclonal_antibody	Imgatuzumab	anti-EGFR_monoclonal_antibody	2021-003262-12  PO-001	Phase 2 Study of Imgatuzumab in Patients With Advanced Cutaneous Squamous Cell Carcinoma (I-PACE)	Cutaneous Squamous Cell Carcinoma	3000 - Melbourne; 2298 - Waratah; 6009 - Nedlands	https://clinicaltrials.gov/ct2/show/NCT04985825
NCT05155254	KEYNOTE-D18	Phase 3	Recruiting	NSW	13/12/2021	21/12/2021	Pembrolizumab	anti-PD-1_monoclonal_antibody	Pembrolizumab	anti-PD-1_monoclonal_antibody	2021-004594-32  IO102-IO103-013 / KEYNOTE-D18	An Open-label, Randomized, Phase 3 Clinical Trial of IO102-IO103 in Combination With Pembrolizumab Versus Pembrolizumab Alone in Patients With Previously Untreated, Unresectable, or Metastatic (Advanced) Melanoma (IO102-IO103-013 / MK3475-D18)	Metastatic Melanoma; Unresectable Melanoma	2500 - Wollongong	https://clinicaltrials.gov/ct2/show/NCT05155254
NCT05169684	2021-003990-74--CA022-009	Phase 2	Recruiting	SA, VIC, NSW	27/12/2021	14/02/2022	BMS-986218; BMS-986218 + Docetaxel; BMS-986218 + Docetaxel + Nivolumab; BMS-986218 + Nivolumab; Docetaxel; Nivolumab	anti-PD-1_monoclonal_antibody; taxane; anti-CTLA-4_monoclonal_antibody; anti-CTLA-4_monoclonal_antibody + taxane; anti-CTLA-4_monoclonal_antibody + anti-PD-1_monoclonal_antibody; anti-CTLA-4_monoclonal_antibody + anti-PD-1_monoclonal_antibody + taxane	BMS-986218 + Docetaxel; BMS-986218 + Docetaxel + Nivolumab; BMS-986218 + Nivolumab; Docetaxel; BMS-986218 + Docetaxel; BMS-986218 + Docetaxel + Nivolumab; BMS-986218 + Nivolumab	anti-CTLA-4_monoclonal_antibody + anti-PD-1_monoclonal_antibody; anti-CTLA-4_monoclonal_antibody + anti-PD-1_monoclonal_antibody + taxane; anti-CTLA-4_monoclonal_antibody + taxane; taxane; anti-CTLA-4_monoclonal_antibody + anti-PD-1_monoclonal_antibody; anti-CTLA-4_monoclonal_antibody + anti-PD-1_monoclonal_antibody + taxane; anti-CTLA-4_monoclonal_antibody + taxane	2021-003990-74  CA022-009	A Phase 2, Open-label, Randomized Controlled Trial of BMS-986218 or BMS-986218 Plus Nivolumab in Combination With Docetaxel in Participants With Metastatic Castration-resistant Prostate Cancer	Prostatic Neoplasms, Castration-Resistant	5112 - Elizabeth Vale; 3084 - Heidleberg; 2010 - Darlinghurst	https://clinicaltrials.gov/ct2/show/NCT05169684
NCT05309421	KEYNOTE-KN-D36--EVX-01-001	Phase 2	Not yet recruiting	NSW, WA	4/04/2022		EVX-01; EVX-01 + Pembrolizumab; Pembrolizumab	anti-PD-1_monoclonal_antibody + autologous_anticancer_vaccine; anti-PD-1_monoclonal_antibody; autologous_anticancer_vaccine	EVX-01 + Pembrolizumab; EVX-01 + Pembrolizumab	anti-PD-1_monoclonal_antibody + autologous_anticancer_vaccine; anti-PD-1_monoclonal_antibody + autologous_anticancer_vaccine	KEYNOTE KN-D36  EVX-01-001	An Open Label, Single Arm Trial Evaluating the Efficacy and Safety of EVX-01 in Combination With Pembrolizumab in Checkpoint Inhibitor Treatment naïve Adults With Unresectable or Metastatic Melanoma	Melanoma Stage III; Melanoma Stage IV	2065 - Wollstonecraft; 6009 - Nedlands	https://clinicaltrials.gov/ct2/show/NCT05309421
NCT05440864	NEOTOMA	Unknown	Not yet recruiting		1/07/2022		Durvalumab; Durvalumab + Tremelimumab; Tremelimumab	anti-PD-L1_monoclonal_antibody; anti-CTLA-4_monoclonal_antibody + anti-PD-L1_monoclonal_antibody; anti-CTLA-4_monoclonal_antibody	Durvalumab + Tremelimumab; Durvalumab + Tremelimumab	anti-CTLA-4_monoclonal_antibody + anti-PD-L1_monoclonal_antibody; anti-CTLA-4_monoclonal_antibody + anti-PD-L1_monoclonal_antibody	22-5353	Perioperative Therapy With Durvalumab Plus Tremelimumab for Patients With Resectable Hepatocellular Carcinoma (HCC) - A Phase II Trial (NEOTOMA)	Hepatocellular Carcinoma		https://clinicaltrials.gov/ct2/show/NCT05440864
NCT05498428	PALOMA-2	Phase 2	Recruiting	WA, VIC	12/08/2022	11/11/2022	Amivantamab; Amivantamab + Carboplatin + Lazertinib + Osimertinib + Pemetrexed; Amivantamab + Carboplatin + Pemetrexed; Amivantamab + Lazertinib; Carboplatin; Lazertinib; Osimertinib; Pemetrexed	bispecific_cMET/EGFR_monoclonal_antibody; antimetabolite + bispecific_cMET/EGFR_monoclonal_antibody + platinum-based_antineoplastic_agent; EGFR_inhibitor,third_generation; platinum-based_antineoplastic_agent; EGFR_inhibitor,third_generation + antimetabolite + bispecific_cMET/EGFR_monoclonal_antibody + platinum-based_antineoplastic_agent; antimetabolite; EGFR_inhibitor,third_generation + bispecific_cMET/EGFR_monoclonal_antibody	Amivantamab + Carboplatin + Lazertinib + Osimertinib + Pemetrexed; Amivantamab + Carboplatin + Pemetrexed; Amivantamab + Lazertinib; Amivantamab + Carboplatin + Lazertinib + Osimertinib + Pemetrexed; Amivantamab + Carboplatin + Pemetrexed; Amivantamab + Lazertinib	EGFR_inhibitor,third_generation + antimetabolite + bispecific_cMET/EGFR_monoclonal_antibody + platinum-based_antineoplastic_agent; EGFR_inhibitor,third_generation + bispecific_cMET/EGFR_monoclonal_antibody; antimetabolite + bispecific_cMET/EGFR_monoclonal_antibody + platinum-based_antineoplastic_agent; EGFR_inhibitor,third_generation + antimetabolite + bispecific_cMET/EGFR_monoclonal_antibody + platinum-based_antineoplastic_agent; EGFR_inhibitor,third_generation + bispecific_cMET/EGFR_monoclonal_antibody; antimetabolite + bispecific_cMET/EGFR_monoclonal_antibody + platinum-based_antineoplastic_agent	2022-000526-21  CR109264	A Phase 2, Open-Label, Parallel Cohort Study of Subcutaneous Amivantamab in Multiple Regimens in Patients With Advanced or Metastatic Solid Tumors Including EGFR-mutated Non-Small Cell Lung Cancer	Carcinoma, Non-small-Cell Lung	6009 - Nedlands; VIC 3084 - Heidelberg	https://clinicaltrials.gov/ct2/show/NCT05498428
NCT05562830	MK-3475-04A--3475-04A	Phase 1/Phase 2	Recruiting	QLD	3/10/2022	16/11/2022	Pembrolizumab	anti-PD-1_monoclonal_antibody	Pembrolizumab	anti-PD-1_monoclonal_antibody	MK-3475-04A  3475-04A	A Phase 1/2 Open-Label Rolling-Arm Umbrella Platform Study of Investigational Agents With or Without Pembrolizumab in Participants With PD-1/L1 Refractory Locally Advanced or Metastatic Urothelial Carcinoma (KEYMAKER-U04): Substudy 04A	Urothelial Carcinoma	4029 - Brisbane	https://clinicaltrials.gov/ct2/show/NCT05562830
NCT05650203	JS009-002-I	Phase 1	Not yet recruiting	WA, QLD, NSW	14/12/2022		JS-006; JS-006 + JS-009 + Toripalimab; JS-009; Toripalimab	anti-PD-1_monoclonal_antibody; anti-CD112R_monoclonal_antibody + anti-PD-1_monoclonal_antibody + anti-TIGIT_monoclonal_antibody; anti-TIGIT_monoclonal_antibody; anti-CD112R_monoclonal_antibody	JS-006 + JS-009 + Toripalimab; JS-006 + JS-009 + Toripalimab	anti-CD112R_monoclonal_antibody + anti-PD-1_monoclonal_antibody + anti-TIGIT_monoclonal_antibody; anti-CD112R_monoclonal_antibody + anti-PD-1_monoclonal_antibody + anti-TIGIT_monoclonal_antibody	JS009-002-I	A Phase 1 Study to Evaluate the Safety, Tolerability, Pharmacokinetics and Preliminary Efficacy of JS009 Monotherapy and JS009 as a Triple Combination Therapy in Combination With Toripalimab and JS006 in Patients With Advanced Malignancies	Primary Condition: Advanced Tumors	4101 - South Brisbane; 6009 - Perth; 2148 - Blacktown	https://clinicaltrials.gov/ct2/show/NCT05650203
