trial_id	trialacronym	phase	recruitmentstatus	recruitmentstate	approvaldate	actualstartdate	drug_list	drug_classes	combo_list	combo_classes	secondaryid	studytitle	healthcondition	postcode	ext_weblink
NCT05494918	NCT05494918	Phase 1	Recruiting	WA	08/08/2022		JSKN003	anti-ERBB2_antibody-drug_conjugate	JSKN003	anti-ERBB2_antibody-drug_conjugate		A Phase I, Multi-center, Open-label, Dose Escalation, First-In-Human Study to Assess the Safety, Tolerability and Pharmacokinetics of JSKN003 in Subjects With Advanced or Metastatic Solid Malignant Tumors	Advanced Solid Tumors; Metastatic Solid Tumors	6009 - Perth - Breast Cancer Research Centre	https://clinicaltrials.gov/ct2/show/NCT05494918
NCT05498597	NCT05498597	Phase 1	Recruiting	WA, SA, NSW, VIC, QLD	10/08/2022		AMT-151	anti-FR-alpha_antibody-drug_conjugate	AMT-151	anti-FR-alpha_antibody-drug_conjugate		First-in-Human, Phase 1 Study of AMT-151, an Anti-Folate Receptor Alpha Antibody-Drug Conjugate, in Patients With Selected Advanced Solid Tumours	Advanced Solid Tumor; Advanced Cancer; Advanced Carcinoma; Ovarian Cancer; Ovarian Carcinoma; Ovarian Epithelial Cancer; Ovarian Endometrioid Adenocarcinoma; Endometrial Cancer; Endometrial Adenocarcinoma; Endometrial Serous Adenocarcinoma; Endometrial Endometrioid Adenocarcinoma; Endometrial Clear Cell Adenocarcinoma; Lung Adenocarcinoma; Triple Negative Breast Cancer; Pancreatic Ductal Adenocarcinoma; Malignant Pleural Mesothelioma; Ovarian Clear Cell Carcinoma; Ovarian Clear Cell Adenocarcinoma; Ovarian Mucinous Adenocarcinoma	Adelaide - Cancer Research SA; Brisbane - ICON Cancer Centre; Malvern - Cabrini Malvern Hospital; Perth - One Clinical Research (OCR); South Brisbane - Mater Cancer Care Centre; Sydney - Chris O'Brien Lifehouse	https://clinicaltrials.gov/ct2/show/NCT05498597
NCT05500508	NCT05500508	Phase 1/Phase 2	Recruiting	NSW	12/08/2022		AMXT-1501	polyamine_transport_inhibitor	AMXT-1501	polyamine_transport_inhibitor		A Phase 1B/2A Study of the Safety, Tolerability and Initial Efficacy of Oral AMXT 1501 Dicaprate and Intravenous Difluoromethylornithine (DFMO) in Patients With Cancer	Cancer; Solid Tumor; Solid Carcinoma; Advanced Cancer; DIPG Brain Tumor; Ovary Cancer; Breast Cancer; Papillary Thyroid Cancer; Head and Neck Cancer; Gastric Cancer; Nsclc; Mesotheliomas Pleural; Mesothelioma Peritoneum; Esophageal Cancer; Diffuse Midline Glioma, H3 K27M-Mutant; Endometrial Cancer; Cervical Cancer; Melanoma; Colorectal Cancer; Glioma, Malignant	Sydney - Kids Cancer Centre	https://clinicaltrials.gov/ct2/show/NCT05500508
NCT05501886	VIKTORIA-1	Phase 3	Recruiting	NSW, QLD, VIC, TAS, WA, SA	12/08/2022		Alpelisib; Alpelisib + Fulvestrant; Fulvestrant; Fulvestrant + Gedatolisib; Fulvestrant + Gedatolisib + Palbociclib; Gedatolisib; Palbociclib	pan-PI3K/mTORC1/mTORC2_inhibitor + selective_estrogen_receptor_degrader; PI3K_alpha_inhibitor + selective_estrogen_receptor_degrader; PI3K_alpha_inhibitor; CDK4/6_inhibitor; selective_estrogen_receptor_degrader; CDK4/6_inhibitor + pan-PI3K/mTORC1/mTORC2_inhibitor + selective_estrogen_receptor_degrader; pan-PI3K/mTORC1/mTORC2_inhibitor	Alpelisib + Fulvestrant; Fulvestrant; Fulvestrant + Gedatolisib; Fulvestrant + Gedatolisib + Palbociclib; Alpelisib + Fulvestrant; Fulvestrant + Gedatolisib; Fulvestrant + Gedatolisib + Palbociclib	CDK4/6_inhibitor + pan-PI3K/mTORC1/mTORC2_inhibitor + selective_estrogen_receptor_degrader; PI3K_alpha_inhibitor + selective_estrogen_receptor_degrader; pan-PI3K/mTORC1/mTORC2_inhibitor + selective_estrogen_receptor_degrader; selective_estrogen_receptor_degrader; CDK4/6_inhibitor + pan-PI3K/mTORC1/mTORC2_inhibitor + selective_estrogen_receptor_degrader; PI3K_alpha_inhibitor + selective_estrogen_receptor_degrader; pan-PI3K/mTORC1/mTORC2_inhibitor + selective_estrogen_receptor_degrader	2021-005235-24	Phase 3, Open-Label, Randomized, Study Comparing Gedatolisib Combined With Fulvestrant &amp; With or Without Palbociclib to Standard-of-Care Therapies in Patients With HR-Positive, HER2-Negative Advanced Breast Cancer Previously Treated With a CDK4/6 Inhibitor in Combination w/Non-Steroidal Aromatase Inhibitor Therapy	Breast Cancer	Adelaide - Adelaide Oncology &amp; Haematology; Fitzroy - St Vincent's Hospital (Melbourne) Ltd; Frankston - Peninsula &amp; South Eastern Hematology and Oncology Group (PSEHOG); Nedlands - Hollywood Private Hospital, Breast Cancer Research Centre; South Brisbane - Mater Hospital Brisbane, Mater Cancer Care Centre; Southport - Icon Cancer Centre- Southport; Wahroonga - Sydney Adventist Hospital; Woodville - The Queen Elizabeth Hospital	https://clinicaltrials.gov/ct2/show/NCT05501886
NCT05505825	NCT05505825	Phase 1/Phase 2	Recruiting	NSW, QLD, VIC, SA	16/08/2022		AK104	bispecific_PD-1/CTLA-4_antibody	AK104	bispecific_PD-1/CTLA-4_antibody		A Phase Ib/II Clinical Study of Anti-PD-1 and CTLA-4 Bispecific Antibody, Cadonilimab(AK104), in Combination With Chiauranib in the Treatment of Patients With Extensive Stage Small Cell Lung Cancer Who Failed First-line Platinum-based Chemotherapy in Combination With Programmed Cell Death-1(PD1)/Programmed Cell Death Protein Ligand-1(PDL1) Inhibitors	SCLC,Extensive Stage	Bedford Park - Flinders Medical Centre; Frankston - Peninsula &amp; South Eastern Haematology and Oncology Group; South Brisbane - Icon Cancer Centre; St Albans - Sunshine Hospital; Westmead - Westmead Hospital; Woolloongabba - Princess Alexandra Hospital	https://clinicaltrials.gov/ct2/show/NCT05505825
NCT05508906	NCT05508906	Phase 1	Recruiting	WA, NSW	18/08/2022		Alpelisib; Alpelisib + Palazestrant; Palazestrant; Palazestrant + Ribociclib; Ribociclib	PI3K_alpha_inhibitor + complete_estrogen_receptor_antagonist; PI3K_alpha_inhibitor; CDK4/6_inhibitor; complete_estrogen_receptor_antagonist; CDK4/6_inhibitor + complete_estrogen_receptor_antagonist	Alpelisib + Palazestrant; Palazestrant + Ribociclib; Alpelisib + Palazestrant; Palazestrant + Ribociclib	CDK4/6_inhibitor + complete_estrogen_receptor_antagonist; PI3K_alpha_inhibitor + complete_estrogen_receptor_antagonist; CDK4/6_inhibitor + complete_estrogen_receptor_antagonist; PI3K_alpha_inhibitor + complete_estrogen_receptor_antagonist		A Phase 1b Open-Label Multicenter Study of OP-1250 in Combination With the CDK4/6 Inhibitor Ribociclib or With the PI3K Inhibitor Alpelisib in Adult Subjects With Advanced and/or Metastatic HR Positive, HER2 Negative Breast Cancer	Metastatic Breast Cancer; Advanced Breast Cancer; HR-positive Breast Cancer; HER2-negative Breast Cancer	2109 - New South Wales - Macquarie Health; 6009 - Nedlands - Breast Cancer Research Center- Western Australia	https://clinicaltrials.gov/ct2/show/NCT05508906
NCT05509985	NCT05509985	Phase 1	Not yet recruiting	SA, NSW	18/08/2022		ASKG315; Pembrolizumab	anti-PD-1_monoclonal_antibody; IL-15_prodrug	ASKG315; Pembrolizumab	IL-15_prodrug; anti-PD-1_monoclonal_antibody		A Phase 1 Dose Escalation Study to Evaluate the Safety, Tolerability and Pharmacokinetics of ASKG315 as a Single Agent and in Combination With Pembrolizumab in Patients With Advanced Solid Tumors	Advanced Solid Tumors	Melbourne - The Alfred Hospital; Sydney - Blacktown Hospital	https://clinicaltrials.gov/ct2/show/NCT05509985
NCT05512377	U1111-1292-3392	Phase 2	Recruiting	SA, VIC, QLD, NSW	22/08/2022		Brigimadlin	MDM2_inhibitor	Brigimadlin	MDM2_inhibitor	2022-001500-18; U1111-1292-3392	Brightline-2: A Phase IIa/IIb, Open-label, Single-arm, Multi-centre Trial of Brigimadlin (BI 907828) for Treatment of Patients With Locally Advanced / Metastatic, MDM2 Amplified, TP53 Wild-type Biliary Tract Adenocarcinoma, Pancreatic Ductal Adenocarcinoma, or Other Selected Solid Tumours	Pancreatic Neoplasms; Solid Tumors; Biliary Tract Cancer; Lung Neoplasms; Bladder Cancer	2031 - Randwick - Prince of Wales Hospital; 3084 - Heidelberg - Austin Health; 4101 - South Brisbane - ICON; 5042 - Bedford Park - Flinders Medical Centre	https://clinicaltrials.gov/ct2/show/NCT05512377
NCT05513703	2022-500608-23-00	Phase 2	Recruiting	VIC	23/08/2022		Telisotuzumab Vedotin	anti-cMET_antibody-drug_conjugate	Telisotuzumab Vedotin	anti-cMET_antibody-drug_conjugate	2022-500608-23-00	Phase 2, Open-Label Study in Subjects With Previously Untreated MET Amplified Locally Advanced/Metastatic Non-Squamous Non-Small Cell Lung Cancer (NSCLC)	Non Small Cell Lung Cancer	3168 - Clayton - Monash Medical Centre /ID# 247679	https://clinicaltrials.gov/ct2/show/NCT05513703
NCT05519449	ENGAGER-PSMA-01	Phase 1	Recruiting	NSW, WA, SA	25/08/2022		JANX007	PSMA-tumor-activated_T-cell_engager	JANX007	PSMA-tumor-activated_T-cell_engager	ENGAGER-PSMA-01	A Phase 1, Open-Label, Multicenter Study of JANX007 in Subjects With Metastatic Castration-Resistant Prostate Cancer	Prostate Cancer; Metastatic Castration-resistant Prostate Cancer; Castration Resistant Prostatic Cancer	2050 - Camperdown - Chris O'Brien Lifehouse (COBLH); 5042 - Bedford Park - Southern Oncology Clinical Research Unit (SoCRU); 6009 - Nedlands - Linear Clinical Research Ltd.	https://clinicaltrials.gov/ct2/show/NCT05519449
NCT05523947	NCT05523947	Phase 1/Phase 2	Recruiting	WA, SA, NSW	29/08/2022		YH32367	bispecific_ERBB2/4-1BB_antibody	YH32367	bispecific_ERBB2/4-1BB_antibody		A Phase 1/2, Non-randomized, Open-label, Multicenter, First-in-Human Study to Evaluate the Safety, Tolerability, Pharmacokinetics and Anti-tumor Activity of YH32367 in Patients With HER2-Positive Locally Advanced or Metastatic Solid Tumors	HER2-Positive Solid Tumor	Adelaide - Southern Oncology Clinical Research Unit; Perth - Breast Cancer Research Centre - WA - (Withdrawn); Sydney - Blacktown Hospital	https://clinicaltrials.gov/ct2/show/NCT05523947
NCT05525247	NCT05525247	Phase 1/Phase 2	Recruiting	NSW, Perth, WA	30/08/2022		Gemcitabine	gemcitabine; antimetabolite	Gemcitabine	antimetabolite; gemcitabine		A Phase 1/2, Open-label, Multicenter, Dose Escalation and Expansion Study of SLC-3010 Monotherapy and in Combination With Various Anticancer Therapies in Patients With Advanced Solid Tumors	Advanced Solid Tumor	2298 - Waratah - Selecxine Investigator site - (Not yet recruiting); 6153 - Brentwood - Selecxine Investigator site - (Not yet recruiting)	https://clinicaltrials.gov/ct2/show/NCT05525247
NCT05533697	2023-504506-11-00	Phase 1/Phase 2	Recruiting	WA, VIC, NSW	07/09/2022		Pembrolizumab; Pembrolizumab + mRNA-4359; mRNA-4359	anti-PD-1_monoclonal_antibody; mRNA_personalised_cancer_vaccine,IDO/PD-L1-targeting; anti-PD-1_monoclonal_antibody + mRNA_personalised_cancer_vaccine,IDO/PD-L1-targeting	Pembrolizumab + mRNA-4359; mRNA-4359; Pembrolizumab + mRNA-4359	anti-PD-1_monoclonal_antibody + mRNA_personalised_cancer_vaccine,IDO/PD-L1-targeting; mRNA_personalised_cancer_vaccine,IDO/PD-L1-targeting; anti-PD-1_monoclonal_antibody + mRNA_personalised_cancer_vaccine,IDO/PD-L1-targeting	2023-504506-11-00	Phase 1/2 Study of mRNA-4359 Administered Alone and in Combination With Immune Checkpoint Blockade in Participants With Advanced Solid Tumors	Advanced Solid Tumors	2065 - Wollstonecraft - Melanoma Institute Australia; 3084 - Melbourne - Austin Hospital; 6009 - Nedlands - One Clinical Research	https://clinicaltrials.gov/ct2/show/NCT05533697
NCT05537051	NCT05537051	Phase 1	Not yet recruiting		08/09/2022		PM8001	bifunctional_PD-L1/TGF-beta_fusion_protein	PM8001	bifunctional_PD-L1/TGF-beta_fusion_protein		A Phase I Clinical Trial to Evaluate the Safety, Tolerability, Pharmacokinetics, and Preliminary Efficacy of PM1021 (Anti-TIGIT) Monotherapy and PM1021 in Combination With PM8001 (Anti-PD-L1/TGF-β) in Patients With Advanced Solid Tumours	Advanced Solid Tumours		https://clinicaltrials.gov/ct2/show/NCT05537051
NCT05543629	U1111-1283-1243	Phase 1/Phase 2	Recruiting	NSW, VIC, QLD, WA	14/09/2022		Carboplatin; Carboplatin + Nivolumab + Paclitaxel; Carboplatin + Nivolumab + Pemetrexed; Docetaxel; Docetaxel + Nivolumab; Nivolumab; Paclitaxel; Pemetrexed	anti-PD-1_monoclonal_antibody + platinum-based_antineoplastic_agent + taxane; anti-PD-1_monoclonal_antibody; platinum-based_antineoplastic_agent; taxane; antimetabolite; anti-PD-1_monoclonal_antibody + taxane; anti-PD-1_monoclonal_antibody + antimetabolite + platinum-based_antineoplastic_agent	Carboplatin + Nivolumab + Paclitaxel; Carboplatin + Nivolumab + Pemetrexed; Docetaxel + Nivolumab; Nivolumab; Carboplatin + Nivolumab + Paclitaxel; Carboplatin + Nivolumab + Pemetrexed; Docetaxel + Nivolumab	anti-PD-1_monoclonal_antibody; anti-PD-1_monoclonal_antibody + antimetabolite + platinum-based_antineoplastic_agent; anti-PD-1_monoclonal_antibody + platinum-based_antineoplastic_agent + taxane; anti-PD-1_monoclonal_antibody + taxane; anti-PD-1_monoclonal_antibody + antimetabolite + platinum-based_antineoplastic_agent; anti-PD-1_monoclonal_antibody + platinum-based_antineoplastic_agent + taxane; anti-PD-1_monoclonal_antibody + taxane	2022-501676-26; U1111-1283-1243	A Phase 1b/2 Study of BMS-986442 in Combination With Nivolumab or Nivolumab and Chemotherapies in Participants With Advanced Solid Tumors and Non-small Cell Lung Cancer	Advanced Solid Tumors; Non-small Cell Lung Cancer	2010 - Darlinghurst - Local Institution - 0018; 2145 - Westmead - Local Institution - 0001; 3168 - Clayton - Local Institution - 0002; 4215 - Southport - Local Institution - 0086 - (Not yet recruiting); 6150 - Murdoch - Local Institution - 0084	https://clinicaltrials.gov/ct2/show/NCT05543629
NCT05544552	SURF301	Phase 1/Phase 2	Recruiting	WA, QLD, VIC, NSW	15/09/2022		TYRA-300	FGFR3_inhibitor	TYRA-300	FGFR3_inhibitor		A Multicenter, Open-label Phase 1/2 Study of TYRA300 in Advanced Urothelial Carcinoma and Other Solid Tumors With Activating FGFR3 Gene Alterations (SURF301)	Locally Advanced Urothelial Carcinoma; Metastatic Urothelial Carcinoma; Solid Tumor; Urothelial Carcinoma; Solid Tumor, Adult; Bladder Cancer; Non-muscle-invasive Bladder Cancer; FGFR3 Gene Mutation; FGFR3 Gene Alteration; Advanced Solid Tumor; Advanced Urothelial Carcinoma; Urinary Tract Cancer; Urinary Tract Tumor; Urinary Tract Carcinoma	2109 - Macquarie Park - Macquarie University; 3000 - Melbourne - Peter MacCallum Cancer Research Unit; 3084 - Heidelberg - Austin Health; 4102 - Woolloongabba - Princess Alexandra Hospital; 4215 - Southport - Tasman Oncology; 6009 - Nedlands - Linear Clinical Research Limited	https://clinicaltrials.gov/ct2/show/NCT05544552
NCT05549297	NCT05549297	Phase 2/Phase 3	Recruiting	NSW, VIC, QLD	19/09/2022		Pembrolizumab; Pembrolizumab + Tebentafusp; Tebentafusp	anti-PD-1_monoclonal_antibody; anti-CD3/scFv_fusion_protein,gp100-targeting; anti-CD3/scFv_fusion_protein,gp100-targeting + anti-PD-1_monoclonal_antibody	Pembrolizumab + Tebentafusp; Tebentafusp; Pembrolizumab + Tebentafusp	anti-CD3/scFv_fusion_protein,gp100-targeting; anti-CD3/scFv_fusion_protein,gp100-targeting + anti-PD-1_monoclonal_antibody; anti-CD3/scFv_fusion_protein,gp100-targeting + anti-PD-1_monoclonal_antibody		Phase 2/3 Randomized Study of Tebentafusp as Monotherapy and in Combination With Pembrolizumab Versus Investigator's Choice in HLA-A*02:01-positive Participants With Previously Treated Advanced Melanoma (TEBE-AM)	Advanced Melanoma	2065 - Wollstonecraft - Melanoma Institute Australia; 3004 - Melbourne - Alfred Health; 4102 - Woolloongabba - Princess Alexandra Hospital; 4120 - Greenslopes - Gallipoli Medical Research Foundation (GMRF)	https://clinicaltrials.gov/ct2/show/NCT05549297
NCT05555732	2022-500802-16-00	Phase 3	Recruiting	SA, NSW, VIC, QLD	22/09/2022		Carboplatin; Carboplatin + Cisplatin + Pembrolizumab; Carboplatin + Cisplatin + Pembrolizumab + Pemetrexed; Cisplatin; Datopotamab deruxtecan; Pembrolizumab; Pemetrexed	anti-Trop2_antibody-drug_conjugate; anti-PD-1_monoclonal_antibody; platinum-based_antineoplastic_agent; anti-PD-1_monoclonal_antibody + platinum-based_antineoplastic_agent; antimetabolite; anti-PD-1_monoclonal_antibody + antimetabolite + platinum-based_antineoplastic_agent	Carboplatin + Cisplatin + Pembrolizumab; Carboplatin + Cisplatin + Pembrolizumab + Pemetrexed; Pembrolizumab; Carboplatin + Cisplatin + Pembrolizumab; Carboplatin + Cisplatin + Pembrolizumab + Pemetrexed; Datopotamab deruxtecan	anti-PD-1_monoclonal_antibody; anti-PD-1_monoclonal_antibody + antimetabolite + platinum-based_antineoplastic_agent; anti-PD-1_monoclonal_antibody + platinum-based_antineoplastic_agent; anti-PD-1_monoclonal_antibody + antimetabolite + platinum-based_antineoplastic_agent; anti-PD-1_monoclonal_antibody + platinum-based_antineoplastic_agent; anti-Trop2_antibody-drug_conjugate	2022-500802-16-00	A Randomized Phase 3 Study of Datopotamab Deruxtecan (Dato-DXd) and Pembrolizumab With or Without Platinum Chemotherapy in Subjects With No Prior Therapy for Advanced or Metastatic PD-L1 TPS &lt;50% Non-squamous Non-small Cell Lung Cancer Without Actionable Genomic Alterations (TROPION-Lung07)	Metastatic Non Small Cell Lung Cancer	2500 - Wollongong - Southern Medical Day Care Centre; 3199 - Frankston - PSEHOG (Peninsula and South Eastern Haematology and Oncology Group); 5000 - Adelaide - CRSA/ St Andrews Hospital; QLD 4102 - Woolloongabba - Princess Alexandra Hospital	https://clinicaltrials.gov/ct2/show/NCT05555732
NCT05568095	STAR-221	Phase 3	Recruiting	VIC, NSW, WA	03/10/2022		Capecitabine; Capecitabine + Domvanalimab + Fluorouracil + Leucovorin + Oxaliplatin + Zimberelimab; Domvanalimab; Fluorouracil; Leucovorin; Nivolumab; Oxaliplatin; Zimberelimab	fluoropyrimidine; anti-TIGIT_monoclonal_antibody; folinic_acid; anti-PD-1_monoclonal_antibody; Fluorouracil; platinum-based_antineoplastic_agent; anti-PD-1_monoclonal_antibody + anti-TIGIT_monoclonal_antibody + fluoropyrimidine + folinic_acid + platinum-based_antineoplastic_agent	Capecitabine + Domvanalimab + Fluorouracil + Leucovorin + Oxaliplatin + Zimberelimab; Nivolumab; Capecitabine + Domvanalimab + Fluorouracil + Leucovorin + Oxaliplatin + Zimberelimab	anti-PD-1_monoclonal_antibody; anti-PD-1_monoclonal_antibody + anti-TIGIT_monoclonal_antibody + fluoropyrimidine + folinic_acid + platinum-based_antineoplastic_agent; Fluorouracil; anti-PD-1_monoclonal_antibody + anti-TIGIT_monoclonal_antibody + fluoropyrimidine + folinic_acid + platinum-based_antineoplastic_agent	2022-002222-27; jRCT2051220179; MOH_2023-04-30_012590; CTR20233469; CTR20233470	A Randomized, Open-Label, Multicenter Phase 3 Trial of Domvanalimab, Zimberelimab, and Chemotherapy Versus Nivolumab and Chemotherapy in Participants With Previously Untreated Locally Advanced Unresectable or Metastatic Gastric, Gastroesophageal Junction, and Esophageal Adenocarcinoma	Advanced Upper Gastrointestinal Tract Adenocarcinoma	Clayton - Monash University; Gosford - Gosford Hospital; Liverpool - Liverpool Hospital; Murdoch - Oncology West - Murdoch	https://clinicaltrials.gov/ct2/show/NCT05568095
NCT05570227	MetaMel	N/A	Recruiting	VIC	04/10/2022							Identification of Metabolic Phenotypes Associated With Prognosis and Therapeutic Response in Patients With Melanoma	Melanoma	3002 - Melbourne - Peter Mac Callum Cancer Centre	https://clinicaltrials.gov/ct2/show/NCT05570227
NCT05577715	MORAb-202-G000-203	Phase 2	Recruiting	WA, VIC, NSW	10/10/2022		Farletuzumab Ecteribulin	anti-FR-alpha_antibody-drug_conjugate	Farletuzumab Ecteribulin	anti-FR-alpha_antibody-drug_conjugate	2022-000131-23; MORAb-202-G000-203	A Phase 2, Open-label, Randomized Study of MORAb-202 (Farletuzumab Ecteribulin), a Folate Receptor Alpha-targeting Antibody-Drug Conjugate, in Participants With Metastatic Non-Small Cell Lung Cancer (NSCLC) Adenocarcinoma (AC) After Progression on Prior Therapies	Carcinoma, Non-Small-Cell Lung	1871 - Liverpool - Local Institution - 0032 - (Not yet recruiting); 2500 - Wollongong - Local Institution - 0040; 3350 - Ballarat Central - Local Institution - 0012; 6150 - Murdoch - Local Institution - 0022	https://clinicaltrials.gov/ct2/show/NCT05577715
NCT05580770	NCT05580770	Phase 1/Phase 2	Recruiting	NSW, VIC	11/10/2022		BGB-3245; Mirdametinib	MEK_inhibitor; RAF_dimer_inhibitor	BGB-3245; Mirdametinib	MEK_inhibitor; RAF_dimer_inhibitor		A Phase 1/2a Open-Label, Dose Escalation and Expansion Study to Investigate the Safety, Pharmacokinetics, Pharmacodynamics and Efficacy of Mirdametinib in Combination With BGB-3245 in Patients With Advanced Solid Tumors	Advanced Solid Tumor	2298 - Waratah - Calvary Mater Newcastle; 3000 - Melbourne - Peter MacCallum Cancer Centre	https://clinicaltrials.gov/ct2/show/NCT05580770
NCT05581004	2021-006708-34	Phase 1	Recruiting	WA, NSW, VIC	12/10/2022		Atezolizumab; Atezolizumab + RO7502175; RO7502175	anti-PD-L1_monoclonal_antibody; anti-PD-L1_monoclonal_antibody + unknown_drug_class; unknown_drug_class	Atezolizumab + RO7502175; RO7502175; Atezolizumab + RO7502175	anti-PD-L1_monoclonal_antibody + unknown_drug_class; unknown_drug_class; anti-PD-L1_monoclonal_antibody + unknown_drug_class	2021-006708-34	A Phase Ia/Ib, Open Label, Multicenter, Dose-escalation Study to Evaluate the Safety, Pharmacokinetics, and Activity of RO7502175 as a Single Agent and in Combination With Atezolizumab in Patients With Locally Advanced or Metastatic Solid Tumors	Locally Advanced or Metastatic Solid Tumors; NSCLC; HNSCC; Melanoma; TNBC; Esophageal Cancer; Gastric Cancer; Cervical Cancer; Urothelial Carcinoma; Clear Cell RCC; HCC	2010 - Darlinghurst - Kinghorn Cancer Centre; St Vincents Hospital; 3168 - Clayton - Monash Health Monash Medical Centre; 6009 - Nedlands - Linear Clinical Research Ltd	https://clinicaltrials.gov/ct2/show/NCT05581004
NCT05598151	NCT05598151	Phase 1	Recruiting	SA, VIC	24/10/2022		HM97662	EZH1/2_inhibitor	HM97662	EZH1/2_inhibitor		A Phase I, Open-Label, Multicenter, Dose Escalation and Expansion Study of HM97662 as a Single Agent in Patients With Advanced or Metastatic Solid Tumors	Advanced or Metastatic Solid Tumors	Adelaide - Cancer Research SA; Ballarat - Grampians Health; Clayton - Monash Medical Centre; Frankston - Peninsula and Southeast Oncology	https://clinicaltrials.gov/ct2/show/NCT05598151
NCT05599984	NCT05599984	Phase 1	Recruiting	VIC	28/10/2022		Budigalimab; Carboplatin; Carboplatin + Cisplatin; Cisplatin	anti-PD-1_monoclonal_antibody; platinum-based_antineoplastic_agent	Budigalimab; Carboplatin + Cisplatin; Carboplatin + Cisplatin	anti-PD-1_monoclonal_antibody; platinum-based_antineoplastic_agent		A Phase 1 First-in-Human Study Evaluating Safety, Pharmacokinetics and Efficacy of ABBV-706 as Monotherapy and in Combination With Budigalimab (ABBV-181), Carboplatin, or Cisplatin in Adult Subjects With Advanced Solid Tumors	Advanced Solid Tumors	3000 - Melbourne - Peter MacCallum Cancer Ctr /ID# 259197	https://clinicaltrials.gov/ct2/show/NCT05599984
NCT05605522	NCT05605522	Phase 1	Recruiting	NSW	31/10/2022							A Phase 1 Study of [225Ac]-FPI-2059 in Adult Participants With NTSR1-Expressing Advanced, Metastatic and/or Recurrent Solid Tumours	Pancreatic Ductal Adenocarcinoma (PDAC); Squamous Cell Carcinoma of Head and Neck; Colorectal Cancer; Gastric Cancer; Ewing Sarcoma; NTSR1 Expressing Solid Tumours; Neuroendocrine Differentiated (NED) Prostate Cancer	2145 - Sydney - Westmead Hospital	https://clinicaltrials.gov/ct2/show/NCT05605522
NCT05607498	NCT05607498	Phase 1	Recruiting	VIC, WA	03/11/2022		EMB-07	bispecific_PD-L1/OX40_antibody; bispecific_T-cell_engager,ROR1-targeting	EMB-07	bispecific_PD-L1/OX40_antibody; bispecific_T-cell_engager,ROR1-targeting		A First-in-human, Phase I, Open-Label Study of EMB-07, a Bi-specific Antibody Anti-CD3 and Receptor Tyrosine Kinase-like Orphan Receptor 1 (ROR1) in Patients With Locally Advanced/Metastatic Solid Tumors or Relapse/Refractory Lymphoma	Advanced/Metastatic Solid Tumors; Relapse/Refractory Lymphoma	Frankston - Peninsula and South Eastern Haematology and Oncology Group; Nedlands - One Clinical Research	https://clinicaltrials.gov/ct2/show/NCT05607498
NCT05607550	2022-502977-41-00	Phase 3	Recruiting	VIC, QLD, NSW	04/11/2022		Carboplatin; Carboplatin + Cisplatin + Pemetrexed; Cisplatin; Furmonertinib; Pemetrexed	EGFR_inhibitor,third_generation; platinum-based_antineoplastic_agent; antimetabolite + platinum-based_antineoplastic_agent; antimetabolite; EGFR_inhibitor,exon_20_selective; ERBB2_inhibitor,exon_20_selective	Carboplatin + Cisplatin + Pemetrexed; Furmonertinib; Carboplatin + Cisplatin + Pemetrexed	EGFR_inhibitor,exon_20_selective; EGFR_inhibitor,third_generation; ERBB2_inhibitor,exon_20_selective; antimetabolite + platinum-based_antineoplastic_agent; antimetabolite + platinum-based_antineoplastic_agent	2022-502977-41-00	A Global, Phase 3, Randomized, Multicenter, Open-Label Study to Investigate the Efficacy and Safety of Furmonertinib Compared to Platinum-Based Chemotherapy as First-Line Treatment for Patients With Locally Advanced or Metastatic Non-Small Cell Lung Cancer (NSCLC) With Epidermal Growth Factor Receptor (EGFR) Exon 20 Insertion Mutations (FURVENT)	Metastatic Non-Small Cell Lung Cancer; Advanced Non-Small Cell Lung Cancer; EGFR Exon 20 Mutations	2148 - Blacktown - Arrivent Investigative Site; 3084 - Heidelberg - ArriVent Investigative Site - (Not yet recruiting); 4102 - Woolloongabba - Arrivent Investigative Site; NSW 2065 - St Leonards - Arrivent Investigative Site	https://clinicaltrials.gov/ct2/show/NCT05607550
