trial_id	trialacronym	phase	recruitmentstatus	recruitmentstate	approvaldate	actualstartdate	drug_list	drug_classes	combo_list	combo_classes	secondaryid	studytitle	healthcondition	postcode	ext_weblink
NCT04607421	BREAKWATER	Phase 3	Recruiting	NZ, SA, VIC, QLD, NSW, BAY OF Plenty	22/10/2020		Bevacizumab; Bevacizumab + Capecitabine + Fluorouracil + Irinotecan + Leucovorin + Oxaliplatin; Bevacizumab + Fluorouracil + Irinotecan + Leucovorin; Capecitabine; Cetuximab; Cetuximab + Encorafenib; Cetuximab + Encorafenib + Fluorouracil + Irinotecan + Leucovorin; Cetuximab + Encorafenib + Fluorouracil + Leucovorin + Oxaliplatin; Encorafenib; Fluorouracil; Irinotecan; Leucovorin; Oxaliplatin	BRAF_V600_inhibitor + anti-EGFR_monoclonal_antibody + fluoropyrimidine + folinic_acid + topoisomerase_inhibitor; platinum-based_antineoplastic_agent; topoisomerase_inhibitor; anti-VEGF_monoclonal_antibody + fluoropyrimidine + folinic_acid + topoisomerase_inhibitor; anti-VEGF_monoclonal_antibody + fluoropyrimidine + folinic_acid + platinum-based_antineoplastic_agent + topoisomerase_inhibitor; fluoropyrimidine; BRAF_V600_inhibitor; folinic_acid; anti-VEGF_monoclonal_antibody; Fluorouracil; anti-EGFR_monoclonal_antibody; BRAF_V600_inhibitor + anti-EGFR_monoclonal_antibody + fluoropyrimidine + folinic_acid + platinum-based_antineoplastic_agent; BRAF_V600_inhibitor + anti-EGFR_monoclonal_antibody	Bevacizumab + Capecitabine + Fluorouracil + Irinotecan + Leucovorin + Oxaliplatin; Bevacizumab + Fluorouracil + Irinotecan + Leucovorin; Cetuximab + Encorafenib; Cetuximab + Encorafenib + Fluorouracil + Irinotecan + Leucovorin; Cetuximab + Encorafenib + Fluorouracil + Leucovorin + Oxaliplatin; Bevacizumab + Capecitabine + Fluorouracil + Irinotecan + Leucovorin + Oxaliplatin; Bevacizumab + Fluorouracil + Irinotecan + Leucovorin; Cetuximab + Encorafenib; Cetuximab + Encorafenib + Fluorouracil + Irinotecan + Leucovorin; Cetuximab + Encorafenib + Fluorouracil + Leucovorin + Oxaliplatin	BRAF_V600_inhibitor + anti-EGFR_monoclonal_antibody; BRAF_V600_inhibitor + anti-EGFR_monoclonal_antibody + fluoropyrimidine + folinic_acid + platinum-based_antineoplastic_agent; BRAF_V600_inhibitor + anti-EGFR_monoclonal_antibody + fluoropyrimidine + folinic_acid + topoisomerase_inhibitor; anti-VEGF_monoclonal_antibody + fluoropyrimidine + folinic_acid + platinum-based_antineoplastic_agent + topoisomerase_inhibitor; anti-VEGF_monoclonal_antibody + fluoropyrimidine + folinic_acid + topoisomerase_inhibitor; BRAF_V600_inhibitor + anti-EGFR_monoclonal_antibody; BRAF_V600_inhibitor + anti-EGFR_monoclonal_antibody + fluoropyrimidine + folinic_acid + platinum-based_antineoplastic_agent; BRAF_V600_inhibitor + anti-EGFR_monoclonal_antibody + fluoropyrimidine + folinic_acid + topoisomerase_inhibitor; Fluorouracil; anti-VEGF_monoclonal_antibody + fluoropyrimidine + folinic_acid + platinum-based_antineoplastic_agent + topoisomerase_inhibitor; anti-VEGF_monoclonal_antibody + fluoropyrimidine + folinic_acid + topoisomerase_inhibitor	2020-001288-99; BREAKWATER	AN OPEN-LABEL, MULTICENTER, RANDOMIZED PHASE 3 STUDY OF FIRST-LINE ENCORAFENIB PLUS CETUXIMAB WITH OR WITHOUT CHEMOTHERAPY VERSUS STANDARD OF CARE THERAPY WITH A SAFETY LEAD-IN OF ENCORAFENIB AND CETUXIMAB PLUS CHEMOTHERAPY IN PARTICIPANTS WITH METASTATIC BRAF V600E-MUTANT COLORECTAL CANCER	Neoplasms	1023 - Auckland - Auckland City Hospital; 1023 - Auckland - Auckland District Health Board Charitable Trust; 2050 - Camperdown - Chris O'Brien Lifehouse; 2065 - St Leonards - GenesisCare - North Shore; 2065 - St Leonards - GenesisCare North Shore; 2080 - Mount Kuring-Gai - Slade Pharmacy; 2170 - Liverpool - Liverpool Hospital; 3000 - Melbourne - Peter MacCallum Cancer Centre; 3004 - Melbourne - Alfred Health; 3084 - Heidelberg - Austin Health; 3112 - Tauranga - Tauranga Hospital; 3168 - Clayton - Monash Health; 4029 - Herston - Royal Brisbane &amp; Women's Hospital; 4102 - Woolloongabba - Princess Alexandra Hospital; 5011 - Adelaide - The Queen Elizabeth Hospital	https://clinicaltrials.gov/ct2/show/NCT04607421
NCT04613596	NCT04613596	Phase 2/Phase 3	Recruiting	NSW, QLD, VIC, SA	30/10/2020		Adagrasib; Adagrasib + Pembrolizumab; Pembrolizumab	anti-PD-1_monoclonal_antibody; KRAS_G12C_inhibitor + anti-PD-1_monoclonal_antibody; KRAS_G12C_inhibitor	Adagrasib; Adagrasib + Pembrolizumab; Pembrolizumab; Adagrasib + Pembrolizumab	KRAS_G12C_inhibitor; KRAS_G12C_inhibitor + anti-PD-1_monoclonal_antibody; anti-PD-1_monoclonal_antibody; KRAS_G12C_inhibitor + anti-PD-1_monoclonal_antibody		A Phase 2 Trial of Adagrasib Monotherapy and in Combination With Pembrolizumab and a Phase 3 Trial of Adagrasib in Combination With Pembrolizumab Versus Pembrolizumab in Patients With Advanced Non-Small Cell Lung Cancer With KRAS G12C Mutation	Advanced Non-Small Cell Lung Cancer; Metastatic Non-Small Cell Lung Cancer	2500 - Wollongong - Research Site; 3350 - Ballarat - Research Site; 4102 - Woolloongabba - Research Site; 5042 - Bedford Park - Research Site	https://clinicaltrials.gov/ct2/show/NCT04613596
NCT04618393	NCT04618393	Phase 1/Phase 2	Recruiting	NSW, VIC	04/11/2020		EMB-02	bispecific_PD-1/LAG3_antibody	EMB-02	bispecific_PD-1/LAG3_antibody		A Phase I/II Trial of EMB-02, a Bi-specific Antibody Against PD-1 and LAG-3, in Patients With Advanced Solid Tumors	Advanced Solid Tumors	2500 - Wollongong - Southern Medical Day Care Centre; 3168 - Clayton - Monash Health; 3199 - Frankston - Peninsula &amp; South Eastern Haematology &amp; Oncology Group (PASO)	https://clinicaltrials.gov/ct2/show/NCT04618393
NCT04624204	MK-7339-013	Phase 3	Recruiting	NSW, QLD, VIC	05/11/2020		Dexamethasone; Etoposide; Etoposide + Olaparib + Pembrolizumab + Radiotherapy; Olaparib; Pembrolizumab; Placebo; Radiotherapy	PARP_inhibitor; placebo; radiotherapy; glucocorticoid; anti-PD-1_monoclonal_antibody; PARP_inhibitor + anti-PD-1_monoclonal_antibody + radiotherapy + topoisomerase_inhibitor; topoisomerase_inhibitor	Etoposide + Olaparib + Pembrolizumab + Radiotherapy; Dexamethasone; Etoposide + Olaparib + Pembrolizumab + Radiotherapy; Placebo	PARP_inhibitor + anti-PD-1_monoclonal_antibody + radiotherapy + topoisomerase_inhibitor; PARP_inhibitor + anti-PD-1_monoclonal_antibody + radiotherapy + topoisomerase_inhibitor; glucocorticoid; placebo	MK-7339-013; jRCT2031200296; 2019-003616-31	A Randomized, Double-blind, Placebo-controlled Phase 3 Study of Pembrolizumab (MK-3475) in Combination With Concurrent Chemoradiation Therapy Followed by Pembrolizumab With or Without Olaparib (MK-7339), Compared to Concurrent Chemoradiation Therapy Alone in Participants With Newly Diagnosed Treatment-Naïve Limited-Stage Small Cell Lung Cancer (LS-SCLC)	Small Cell Lung Cancer	2298 - Waratah - Calvary Mater Newcastle ( Site 3000); 2560 - Campbelltown - Campbelltown Hospital ( Site 3002); 2747 - Kingswood - Nepean Hospital ( Site 3001); 3021 - St Albans - Western Health-Sunshine Hospital ( Site 3004) - (Completed); 3084 - Heidelberg - Austin Health-Austin Hospital ( Site 3006); 3199 - Frankston - Frankston Hospital-Oncology and Haematology ( Site 3007); 4215 - Southport - Gold Coast University Hospital ( Site 3003)	https://clinicaltrials.gov/ct2/show/NCT04624204
NCT04631731	ICEMELT	Phase 1/Phase 2	Recruiting	NSW	10/11/2020							Risk Factors of Immune-ChEckpoint Inhibitors MEdiated Liver, Gastrointestinal, Endocrine and Skin Toxicity	Lung Cancer, Nonsmall Cell; Renal Cell Carcinoma; Melanoma; Gastric Cancer; Hepatocellular Carcinoma; Endometrial Cancer; Mesothelioma	2145 - Sydney - Westmead Hospital; 2148 - Sydney - Blacktown Mt Druitt Hospital	https://clinicaltrials.gov/ct2/show/NCT04631731
NCT04644068	PETRA	Phase 1/Phase 2	Recruiting	VIC	19/11/2020		AZD5305; AZD5305 + Camizestrant; AZD5305 + Carboplatin + Paclitaxel; AZD5305 + Datopotamab deruxtecan; AZD5305 + Paclitaxel; AZD5305 + Trastuzumab Deruxtecan; Camizestrant; Carboplatin; Datopotamab deruxtecan; Paclitaxel; Trastuzumab Deruxtecan	PARP_inhibitor + taxane; anti-ERBB2_antibody-drug_conjugate; platinum-based_antineoplastic_agent; taxane; selective_estrogen_receptor_degrader; PARP_inhibitor + platinum-based_antineoplastic_agent + taxane; PARP_inhibitor + anti-Trop2_antibody-drug_conjugate; PARP_inhibitor; anti-Trop2_antibody-drug_conjugate; PARP_inhibitor + anti-ERBB2_antibody-drug_conjugate; PARP_inhibitor + selective_estrogen_receptor_degrader	AZD5305; AZD5305 + Camizestrant; AZD5305 + Carboplatin + Paclitaxel; AZD5305 + Datopotamab deruxtecan; AZD5305 + Paclitaxel; AZD5305 + Trastuzumab Deruxtecan; AZD5305 + Camizestrant; AZD5305 + Carboplatin + Paclitaxel; AZD5305 + Datopotamab deruxtecan; AZD5305 + Paclitaxel; AZD5305 + Trastuzumab Deruxtecan	PARP_inhibitor; PARP_inhibitor + anti-ERBB2_antibody-drug_conjugate; PARP_inhibitor + anti-Trop2_antibody-drug_conjugate; PARP_inhibitor + platinum-based_antineoplastic_agent + taxane; PARP_inhibitor + selective_estrogen_receptor_degrader; PARP_inhibitor + taxane; PARP_inhibitor + anti-ERBB2_antibody-drug_conjugate; PARP_inhibitor + anti-Trop2_antibody-drug_conjugate; PARP_inhibitor + platinum-based_antineoplastic_agent + taxane; PARP_inhibitor + selective_estrogen_receptor_degrader; PARP_inhibitor + taxane	2020-002688-77	A Modular Phase I/IIa, Open-label, Multicentre Study to Assess the Safety, Tolerability, Pharmacokinetics, Pharmacodynamics and Preliminary Efficacy of Ascending Doses of AZD5305 as Monotherapy and in Combination With Anti-cancer Agents in Patients With Advanced Solid Malignancies	Ovarian Cancer; Breast Cancer; Pancreatic Cancer; Prostate Cancer; Additional Indications Below for Module 4 and 5; Non-small Cell Lung Cancer; Colorectal Cancer; Bladder Cancer; Gastric Cancer; Biliary Cancer; Cervical Cancer; Endometrial Cancer; Small Cell Lung Cancer Only in Module 5	3000 - Melbourne - Research Site; 3084 - Heidelberg - Research Site - (Not yet recruiting)	https://clinicaltrials.gov/ct2/show/NCT04644068
NCT04645069	NCT04645069	Phase 1/Phase 2	Recruiting	WA, QLD, VIC, NSW	20/11/2020		ADG106; ADG106 + ADG126; ADG126	anti-4-1BB_agonistic_antibody + anti-CTLA-4_monoclonal_antibody; anti-4-1BB_agonistic_antibody; anti-CTLA-4_monoclonal_antibody	ADG106 + ADG126; ADG126; ADG106 + ADG126	anti-4-1BB_agonistic_antibody + anti-CTLA-4_monoclonal_antibody; anti-CTLA-4_monoclonal_antibody; anti-4-1BB_agonistic_antibody + anti-CTLA-4_monoclonal_antibody		A First-in-Human (FIH), Open-Label, Phase 1/2 Dose Escalation and Expansion Study of ADG126, ADG126 in Combination With Anti PD1 Antibody, and ADG126 in Combination With ADG106 in Patients With Advanced/Metastatic Solid Tumors	Advanced/Metastatic Solid Tumors	2228 - Miranda - Southside Cancer Care Centre - (Active, not recruiting); 3144 - Malvern - Cabrini Health Limited; 4575 - Birtinya - Sunshine Coast University Private Hospital; 6009 - Nedlands - One Clinical Research Pty Ltd; Sydney - Macquarie University Hospital	https://clinicaltrials.gov/ct2/show/NCT04645069
NCT04649385	CTR20212721	Phase 1	Recruiting	NZ, SA, WA, VIC, NSW	25/11/2020		BGB-15025; BGB-15025 + Tislelizumab; Tislelizumab	anti-PD-1_monoclonal_antibody; HPK1_inhibitor + anti-PD-1_monoclonal_antibody; HPK1_inhibitor	BGB-15025; BGB-15025 + Tislelizumab; BGB-15025 + Tislelizumab	HPK1_inhibitor; HPK1_inhibitor + anti-PD-1_monoclonal_antibody; HPK1_inhibitor + anti-PD-1_monoclonal_antibody	CTR20212721	A Phase 1 Study Investigating the Safety, Tolerability, Pharmacokinetics, and Preliminary Antitumor Activity of HPK1 Inhibitor BGB-15025 Alone and in Combination With Anti-PD-1 Monoclonal Antibody Tislelizumab in Patients With Advanced Solid Tumors	Advanced Solid Tumor	1023 - Auckland - Auckland City Hospital; 2031 - Randwick - Prince of Wales Hospital; 3000 - Melbourne - Peter Maccallum Cancer Centre; 5087 - Windsor Gardens - Ashford Cancer Centre Research Northeast; 6009 - Nedlands - Linear Clinical Research; 6009 - Nedlands - One Clinical Research	https://clinicaltrials.gov/ct2/show/NCT04649385
NCT04650581	FINER	Phase 3	Recruiting	NZ, WA, QLD, VIC, ACT, NSW	01/12/2020		Fulvestrant; Fulvestrant + Ipatasertib; Ipatasertib; Placebo	pan-AKT_inhibitor + selective_estrogen_receptor_degrader; selective_estrogen_receptor_degrader; placebo; pan-AKT_inhibitor	Fulvestrant + Ipatasertib; Fulvestrant + Ipatasertib; Placebo	pan-AKT_inhibitor + selective_estrogen_receptor_degrader; pan-AKT_inhibitor + selective_estrogen_receptor_degrader; placebo	2101; M041883	Double-Blind Placebo-Controlled Randomized Phase III Trial of Fulvestrant and Ipatasertib as Treatment for Advanced HER-2 Negative and Estrogen Receptor Positive (ER+) Breast Cancer Following Progression on First Line CDK 4/6 Inhibitor and Aromatase Inhibitor	Breast Cancer	1023 - Auckland - Auckland City Hospital - (Suspended); 2 - Wellington - Wellington Cancer Centre, Wellington Hospital - (Suspended); 2109 - Macquarie University - Macquarie University Hospital; 2250 - Gosford - Gosford Hospital - (Suspended); 2324 - Gateshead - Lake Macquarie Private Hospital - (Suspended); 2541 - Nowra - Shoalhaven Cancer Care Centre - (Suspended); 2576 - Bowral - Southern Highlands Cancer Centre - (Suspended); 3002 - East Melbourne - Victorian Breast and Oncology Care - (Suspended); 3004 - Melbourne - Alfred Hospital - (Not yet recruiting); 3021 - St. Albans - Sunshine Hospital - (Suspended); 3076 - Epping - The Northern Hospital - (Suspended); 3199 - Frankston - Frankston Hospital; 4029 - Herston - Royal Brisbane and Womens Hospital - (Suspended); 4350 - Toowoomba - Toowoomba Hospital; 4575 - Birtinya - Sunshine Coast University Hospital - (Suspended); 6150 - Murdoch - Fiona Stanley Hospital - (Suspended); 6230 - Bunbury - St John of God Bunbury - (Suspended); ACT 2605 - Garran - Canberra Hospital - (Suspended)	https://clinicaltrials.gov/ct2/show/NCT04650581
NCT04665206	NCT04665206	Phase 1	Recruiting	VIC, WA	10/12/2020		VT3989	TEAD_palmitoylation_inhibitor	VT3989	TEAD_palmitoylation_inhibitor		Phase 1, Multi-Center, Open-Label, Study to Evaluate the Safety, Tolerability, and PK of VT3989 in Patients With Refractory Locally Advanced or Metastatic Solid Tumors Enriched for Tumors Harboring Mutations of the NF2 Gene	Solid Tumor, Adult; Mesothelioma	3000 - Melbourne - Peter MacCullum Cancer Centre; 3168 - Clayton - Monash Health; 6009 - Nedlands - Linear Clinical Research	https://clinicaltrials.gov/ct2/show/NCT04665206
NCT04674683	NCT04674683	Phase 3	Recruiting	QLD, VIC, NSW, NZ, WA	14/12/2020		Nivolumab; Placebo	anti-PD-1_monoclonal_antibody; placebo	Nivolumab; Placebo	anti-PD-1_monoclonal_antibody; placebo		A Multicenter, Randomized, Double-Blind Phase 3 Study of HBI-8000 Combined With Nivolumab Versus Placebo With Nivolumab in Patients With Unresectable or Metastatic Melanoma Not Previously Treated With PD-1 or PD-L1 Inhibitors	Unresectable or Metastatic Melanoma; Progressive Brain Metastasis	3112 - Tauranga - Tauranga Hospital; 4556 - Buderim - University of the Sunshine Coast; 4556 - Sippy Downs - University of the Sunshine; Auckland - Auckland City Hospital; Ballarat - Ballarat Health Services; Brisbane - Royal Brisband and Women's Hospital; Hamilton - Waikato Hospital; Liverpool - Liverpool Hospital; Nedlands - Affinity Clinical Research; Shepparton - Goulburn Valley Health; South Brisbane - Icon Cancer Centre Wesley; Tweed Heads - Tweed Hospital; Wahroonga - Sydney Adventist Hospital; Waratah - Calvary Mater Newcastle	https://clinicaltrials.gov/ct2/show/NCT04674683
NCT04675294	KEYNOTE-B87	Phase 2	Recruiting	VIC, QLD, NSW, WA	15/12/2020		Pembrolizumab	anti-PD-1_monoclonal_antibody	Pembrolizumab	anti-PD-1_monoclonal_antibody	KEYNOTE-B87; MK-3475-B87; 2020-004093-21	A Phase 2 Study of ALX148 in Combination With Pembrolizumab in Patients With Advanced Head and Neck Squamous Cell Carcinoma (ASPEN-03)	Head and Neck Cancer; Head and Neck Squamous Cell Carcinoma	2146 - Sydney - St. Vincent's; 3051 - Melbourne - Peter MacCallum Cancer Centre; 4029 - Brisbane - Royal Brisbane and Womens Hospital; 6009 - Perth - Sir Charles Gairdner Hospital	https://clinicaltrials.gov/ct2/show/NCT04675294
NCT04675333	KEYNOTE-B88	Phase 2	Recruiting	SA	17/12/2020		Carboplatin; Cisplatin; Fluorouracil; Pembrolizumab	anti-PD-1_monoclonal_antibody; platinum-based_antineoplastic_agent; fluoropyrimidine	Pembrolizumab; Carboplatin; Cisplatin; Fluorouracil	anti-PD-1_monoclonal_antibody; fluoropyrimidine; platinum-based_antineoplastic_agent	KEYNOTE-B88; MK-3475-B88; 2020-004662-19	A Phase 2 Study of ALX148 in Combination With Pembrolizumab and Chemotherapy in Patients With Advanced Head and Neck Squamous Cell Carcinoma (ASPEN-04)	Head and Neck Cancer; Head and Neck Squamous Cell Carcinoma	5037 - Adelaide - Ashford Cancer Centre	https://clinicaltrials.gov/ct2/show/NCT04675333
NCT04676828	ASPECT	N/A	Recruiting	NSW	15/12/2020		Radiotherapy	radiotherapy	Radiotherapy	radiotherapy		Functional Lung Avoidance SPECT-guided (ASPECT) Radiation Therapy for Lung Cancer Patients: Phase II Randomised Clinical Trial	Lung Cancer; Radiation-Induced Disorder; Radiation Pneumonitis; Pulmonary Disease; Lung Function Decreased	2145 - Sydney - Sydney West Radiation Oncology Network Westmead and Blacktown Hospitals - (Not yet recruiting)	https://clinicaltrials.gov/ct2/show/NCT04676828
NCT04677855	NCT04677855	Phase 1	Recruiting	NSW, SA	16/12/2020		Abiraterone; Abiraterone + PCUR-101 + Prednisone; PCUR-101; Prednisone	glucocorticoid; synthetic_plumbagin; CYP17A1_inhibitor + glucocorticoid + synthetic_plumbagin; CYP17A1_inhibitor	Abiraterone + PCUR-101 + Prednisone; PCUR-101; Abiraterone + PCUR-101 + Prednisone	CYP17A1_inhibitor + glucocorticoid + synthetic_plumbagin; synthetic_plumbagin; CYP17A1_inhibitor + glucocorticoid + synthetic_plumbagin		A Phase I Study of PCUR-101 in Combination With Androgen Directed Therapy in the Treatment of Patients With Metastatic Castration-Resistant Prostate Cancer	Prostate Cancer	2170 - Liverpool - Sydney South West Private Hospital - (Withdrawn); 2217 - Kogarah - St. George Private Hospital - (Completed); 5042 - Bedford Park - Southern Oncology Clinical Research - (Completed)	https://clinicaltrials.gov/ct2/show/NCT04677855
NCT04686305	DL03	Phase 1	Recruiting	VIC, WA, SA	22/12/2020		Carboplatin; Carboplatin + Durvalumab + Trastuzumab Deruxtecan; Carboplatin + MEDI5752 + Trastuzumab Deruxtecan; Cisplatin; Cisplatin + Durvalumab + Trastuzumab Deruxtecan; Durvalumab; Durvalumab + Pemetrexed + Trastuzumab Deruxtecan; MEDI5752; MEDI5752 + Trastuzumab Deruxtecan; Pemetrexed; Trastuzumab Deruxtecan	anti-ERBB2_antibody-drug_conjugate + bispecific_PD-L1/CTLA-4_antibody + platinum-based_antineoplastic_agent; bispecific_PD-L1/CTLA-4_antibody; anti-ERBB2_antibody-drug_conjugate + bispecific_PD-L1/CTLA-4_antibody; anti-PD-L1_monoclonal_antibody; anti-ERBB2_antibody-drug_conjugate; platinum-based_antineoplastic_agent; antimetabolite; anti-ERBB2_antibody-drug_conjugate + anti-PD-L1_monoclonal_antibody + platinum-based_antineoplastic_agent; anti-ERBB2_antibody-drug_conjugate + anti-PD-L1_monoclonal_antibody + antimetabolite	Carboplatin + Durvalumab + Trastuzumab Deruxtecan; Carboplatin + MEDI5752 + Trastuzumab Deruxtecan; Cisplatin + Durvalumab + Trastuzumab Deruxtecan; Durvalumab + Pemetrexed + Trastuzumab Deruxtecan; MEDI5752 + Trastuzumab Deruxtecan; Trastuzumab Deruxtecan; Carboplatin + Durvalumab + Trastuzumab Deruxtecan; Carboplatin + MEDI5752 + Trastuzumab Deruxtecan; Cisplatin + Durvalumab + Trastuzumab Deruxtecan; Durvalumab + Pemetrexed + Trastuzumab Deruxtecan; MEDI5752 + Trastuzumab Deruxtecan	anti-ERBB2_antibody-drug_conjugate; anti-ERBB2_antibody-drug_conjugate + anti-PD-L1_monoclonal_antibody + antimetabolite; anti-ERBB2_antibody-drug_conjugate + anti-PD-L1_monoclonal_antibody + platinum-based_antineoplastic_agent; anti-ERBB2_antibody-drug_conjugate + bispecific_PD-L1/CTLA-4_antibody; anti-ERBB2_antibody-drug_conjugate + bispecific_PD-L1/CTLA-4_antibody + platinum-based_antineoplastic_agent; anti-ERBB2_antibody-drug_conjugate + anti-PD-L1_monoclonal_antibody + antimetabolite; anti-ERBB2_antibody-drug_conjugate + anti-PD-L1_monoclonal_antibody + platinum-based_antineoplastic_agent; anti-ERBB2_antibody-drug_conjugate + bispecific_PD-L1/CTLA-4_antibody; anti-ERBB2_antibody-drug_conjugate + bispecific_PD-L1/CTLA-4_antibody + platinum-based_antineoplastic_agent	2020-003260-31	A Phase Ib Multicenter, Open-label Study to Evaluate the Safety and Tolerability of Trastuzumab Deruxtecan (T-DXd) and Immunotherapy Agents With and Without Chemotherapy Agents in First-line Treatment of Patients With Advanced or Metastatic Non-squamous Non-small Cell Lung Cancer (NSCLC) and Human Epidermal Growth Factor Receptor 2 (HER2) Overexpression (OE) (DESTINY-Lung03)	Locally Advanced or Metastatic Non-Small Cell Lung Cancer	3084 - Heidelberg - Research Site - (Withdrawn); 5000 - Adelaide - Research Site; 6009 - Nedlands - Research Site - (Not yet recruiting)	https://clinicaltrials.gov/ct2/show/NCT04686305
NCT04691804	NCT04691804	Phase 3	Recruiting	SA, VIC, NSW	30/12/2020		Abiraterone; Fuzuloparib; Placebo; Prednisone	glucocorticoid; PARP_inhibitor; placebo; CYP17A1_inhibitor	Fuzuloparib; Abiraterone; Placebo; Prednisone	PARP_inhibitor; CYP17A1_inhibitor; glucocorticoid; placebo		A Multicenter, Randomized, Double-Blind, Placebo-Controlled Phase III Study of Fuzuloparib Combined With Abiraterone Acetate and Prednisone (AA-P) Versus Placebo Combined With AA-P as First-Line Treatment in Patients With Metastatic Castration-Resistant Prostate Cancer	Metastatic Castration-Resistant Prostate Cancer (mCRPC)	Bendigo - Bendigo Health; Concord - Concord Repatriation General Hospital - (Not yet recruiting); Fitzroy - St Vincents Hospital Melbourne - (Not yet recruiting); Gosford - Gosford Hospital; Kurralta Park - Ashford Cancer Centre Research; Melbourne - The Alfred Hospital; St Albans - Western Health; Sydney - Macquarie University; Wagga Wagga - Riverina Cancer Care Centre; Wahroonga - Sydney Adventist Hospital	https://clinicaltrials.gov/ct2/show/NCT04691804
NCT04699188	KontRASt-01	Phase 1/Phase 2	Recruiting	VIC	05/01/2021		JDQ443; JDQ443 + TNO155; JDQ443 + TNO155 + Tislelizumab; JDQ443 + Tislelizumab; TNO155; Tislelizumab	KRAS_G12C_inhibitor + anti-PD-1_monoclonal_antibody; KRAS_G12C_inhibitor; KRAS_G12C_inhibitor + SHP2_inhibitor + anti-PD-1_monoclonal_antibody; KRAS_G12C_inhibitor + SHP2_inhibitor; anti-PD-1_monoclonal_antibody; SHP2_inhibitor	JDQ443; JDQ443 + TNO155; JDQ443 + TNO155 + Tislelizumab; JDQ443 + Tislelizumab; JDQ443 + TNO155; JDQ443 + TNO155 + Tislelizumab; JDQ443 + Tislelizumab	KRAS_G12C_inhibitor; KRAS_G12C_inhibitor + SHP2_inhibitor; KRAS_G12C_inhibitor + SHP2_inhibitor + anti-PD-1_monoclonal_antibody; KRAS_G12C_inhibitor + anti-PD-1_monoclonal_antibody; KRAS_G12C_inhibitor + SHP2_inhibitor; KRAS_G12C_inhibitor + SHP2_inhibitor + anti-PD-1_monoclonal_antibody; KRAS_G12C_inhibitor + anti-PD-1_monoclonal_antibody	2020-004129-22	A Phase Ib/II Open-label, Multi-center Dose Escalation Study of JDQ443 in Patients With Advanced Solid Tumors Harboring the KRAS G12C Mutation	KRAS G12C Mutant Solid Tumors; Carcinoma, Non-Small-Cell Lung; Carcinoma, Colorectal; Cancer of Lung; Cancer of the Lung; Lung Cancer; Neoplasms, Lung; Neoplasms, Pulmonary; Pulmonary Cancer; Pulmonary Neoplasms	3000 - Melbourne - Novartis Investigative Site	https://clinicaltrials.gov/ct2/show/NCT04699188
NCT04702880	U1111-1250-4427	Phase 2	Recruiting	QLD, VIC, NSW, WA	07/01/2021		BMS-986012; BMS-986012 + Carboplatin + Etoposide + Nivolumab; Carboplatin; Carboplatin + Etoposide + Nivolumab; Etoposide; Nivolumab	anti-fucosyl-GM1_monoclonal_antibody; anti-PD-1_monoclonal_antibody + anti-fucosyl-GM1_monoclonal_antibody + platinum-based_antineoplastic_agent + topoisomerase_inhibitor; anti-PD-1_monoclonal_antibody + platinum-based_antineoplastic_agent + topoisomerase_inhibitor; anti-PD-1_monoclonal_antibody; platinum-based_antineoplastic_agent; topoisomerase_inhibitor	BMS-986012 + Carboplatin + Etoposide + Nivolumab; Carboplatin + Etoposide + Nivolumab; BMS-986012 + Carboplatin + Etoposide + Nivolumab; Carboplatin + Etoposide + Nivolumab	anti-PD-1_monoclonal_antibody + anti-fucosyl-GM1_monoclonal_antibody + platinum-based_antineoplastic_agent + topoisomerase_inhibitor; anti-PD-1_monoclonal_antibody + platinum-based_antineoplastic_agent + topoisomerase_inhibitor; anti-PD-1_monoclonal_antibody + anti-fucosyl-GM1_monoclonal_antibody + platinum-based_antineoplastic_agent + topoisomerase_inhibitor; anti-PD-1_monoclonal_antibody + platinum-based_antineoplastic_agent + topoisomerase_inhibitor	2020-001863-10; U1111-1250-4427	A Randomized, Open-label Phase 2 Clinical Trial of BMS-986012 in Combination With Carboplatin, Etoposide, and Nivolumab as First-line Therapy in Extensive-stage Small Cell Lung Cancer	Extensive-stage Small Cell Lung Cancer	2145 - Westmead - Local Institution - 0003 - (Completed); 3144 - Malvern - Local Institution - 0001 - (Completed); 3350 - Ballarat Central - Local Institution - 0078 - (Withdrawn); 4120 - Greenslopes - Local Institution - 0023 - (Active, not recruiting); 6150 - Murdoch - Local Institution - 0004 - (Active, not recruiting)	https://clinicaltrials.gov/ct2/show/NCT04702880
